{
    "title": "Group Timeseries Split",
    "authors": [
        {
            "name": "Matteo Manzi",
            "link": "https://github.com/matteoettam09"
        },
        {
            "name": "Xavier de Vautibault",
            "link": "https://github.com/xaviergilbert"
        }
    ],
    "language": "PYTHON",
    "usage": "SUBMISSION",
    "notebook": true,
    "entrypoint": "group-timeseries-split.ipynb"
}