{
    "title": "Example Tracker",
    "authors": [
        {
            "name": "CrunchDAO",
            "link": "https://github.com/crunchdao"
        }
    ],
    "language": "PYTHON",
    "usage": "SUBMISSION",
    "notebook": true,
    "entrypoint": "https://github.com/crunchdao/numinous/blob/main/challenge/numinous/examples/quickstart.ipynb"
}