{
    "title": "Basic Submission",
    "authors": [
        {
            "name": "Jean Herelle",
            "link": "https://github.com/jeheran"
        },
        {
            "name": "Matteo Manzi",
            "link": "https://github.com/matteoettam09"
        }
    ],
    "language": "PYTHON",
    "usage": "SUBMISSION",
    "notebook": true,
    "entrypoint": "basic-submission.ipynb"
}