{
    "title": "Walk Forward Cross Validation",
    "authors": [
        {
            "name": "Matteo Manzi",
            "link": "https://github.com/matteoettam09"
        },
        {
            "name": "Xavier de Vautibault",
            "link": "https://github.com/xaviergilbert"
        }
    ],
    "language": "PYTHON",
    "usage": "SUBMISSION",
    "notebook": true,
    "deprecated": true,
    "entrypoint": "walk-forward-cross-validation.ipynb"
}