{
    "title": "Regression Baseline",
    "authors": [
        {
            "name": "Alexis GASSMANN",
            "link": "https://github.com/Tarandro"
        }
    ],
    "language": "PYTHON",
    "usage": "SUBMISSION",
    "notebook": true,
    "entrypoint": "regression-baseline.ipynb",
    "kaggleUrl": "https://www.kaggle.com/code/crunchdao/broad-obesity-1-regression-baseline"
}