{
    "title": "Boruta Feature Selection",
    "authors": [
        {
            "name": "Matteo Manzi",
            "link": "https://github.com/matteoettam09"
        }
    ],
    "language": "PYTHON",
    "usage": "SUBMISSION",
    "notebook": true,
    "entrypoint": "boruta-feature-selection.ipynb"
}