{
    "title": "Advanced Modelling Analysis",
    "authors": [
        {
            "name": "Matteo Manzi",
            "link": "https://github.com/matteoettam09"
        }
    ],
    "language": "PYTHON",
    "usage": "EXPLORATION",
    "notebook": true,
    "entrypoint": "advanced-modelling-analysis.ipynb"
}