{
    "title": "R Example",
    "authors": [
        {
            "name": "RWarnung",
            "link": "https://github.com/rwarnung"
        },
        {
            "name": "Matteo Manzi",
            "link": "https://github.com/matteoettam09"
        },
        {
            "name": "Xavier de Vautibault",
            "link": "https://github.com/xaviergilbert"
        }
    ],
    "language": "R",
    "usage": "SUBMISSION",
    "notebook": true,
    "deprecated": true,
    "entrypoint": "r-example.ipynb"
}