{
    "title": "Feature Engineering",
    "authors": [
        {
            "name": "Shreenidhi Hipparagi",
            "link": "https://github.com/Shreenidhi1999"
        },
        {
            "name": "Matteo Manzi",
            "link": "https://github.com/matteoettam09"
        },
        {
            "name": "Jean Herelle",
            "link": "https://github.com/jeheran"
        }
    ],
    "language": "PYTHON",
    "usage": "EXPLORATION",
    "notebook": true,
    "deprecated": true,
    "entrypoint": "feature_engineering.ipynb"
}