{
    "title": "Baseline",
    "description": "Uses a t-test to compare the distributions before and after the boundary point.",
    "authors": [
        {
            "name": "ADIA Lab"
        }
    ],
    "language": "PYTHON",
    "usage": "SUBMISSION",
    "notebook": true,
    "entrypoint": "baseline.ipynb",
    "kaggleUrl": "https://www.kaggle.com/code/crunchdao/structural-break-open-benchmark-baseline"
}